### ISSUE TITLE
Connecting to HomeAssistant UI via WireGuard Client

### ISSUE THREAD

**Issue by goooroooX** [bigmoby/addon-wireguard-client#29]
Hi!

I'm looking the way to connect to Home Assistance instance using WireGuard. Here is a scenario:
 - client (1) is a mobile phone
 - client (2) is a desktop
 - client (3) is a Home Assistant

All the clients are successfully connected to WireGuard server running on VPS. All clients are able to cross-communicate (e.g. ping mobile from desktop and vice-versa). 

Home Assistant's addons are running on separate docker containers, UI and WireGuard are completely separate, so when VPN is connected from addon container, I cannot access UI from other VPN client.

Can you please suggest the way to access Home Assistant UI in such a scenario?
From network perspective this should be something like opening port on addon container that will forward requests to UI container on 8123, but I can hardly imagine how this can be achieved in HASS.

Thank you in advance!

PS: One more weird thing found: Home Assistant is unable to download update and access Internet in general, when addon is running.

**Comment by tobiraak** [comment]
I have the exact same issue. Could provide a solution please or a more detailed documentation?
I am able to get a connection to my VPN Server running on a vserver but I cannot access homeassistant via the URL

**Comment by bigmoby** [comment]
I apologize for the delay in replying! Please take a look at this guide (unfortunately only in Italian) which I think is right for you.
https://github.com/bigmoby/homeassistant_nat_network/blob/main/README.md
And https://github.com/bigmoby/homeassistant_nat_network/blob/main/README_IT_part_2.md

**Comment by bigmoby** [comment]
> [...] Anyway, it seems this addon is just a PoC without any actual usage scenario.

Ipse dixit! ...ok, see you 👍

**Comment by generic1977** [comment]
Hello,

Sorry for refloating this one. I am facing a similar issue. I have configured the WireGuard server on an Oracle Cloud VPS and the WireGuard client on two machines in my local network:

* Home Assistant running on HAOS.
* An Ubuntu server for testing.

The configuration for the Ubuntu server worked. I was able to NAT port 80 in the WireGuard network and the default page was displayed when browsing the public IP. The WireGuard server and clients can ping each other.

My problem is accessing the Home Assistant web UI. I've NATed port 8123 to the HA, but I cannot access the web UI. The WireGuard logs look good, and `tcpdump` on the server shows traffic hitting port 8123. However, the HA WireGuard client container doesn't seem to be responding.

**Here are my configuration details:**

**WireGuard Server (wg0.conf):**

Address = 192.168.100.1/32
ListenPort = 41194
PrivateKey = xx

PreUp = sysctl -w net.ipv4.ip_forward=1

PostUp = iptables -A INPUT -p udp -m udp --dport 41194 -j ACCEPT
PostUp = iptables -A FORWARD -i wg0 -j ACCEPT
PostUp = iptables -A FORWARD -o wg0 -j ACCEPT


PostDown = iptables -A INPUT -p udp -m udp --dport 41194 -j ACCEPT
PostDown = iptables -A FORWARD -i wg0 -j ACCEPT
PostDown = iptables -A FORWARD -o wg0 -j ACCEPT

[Peer]
PublicKey = xx
AllowedIPs = 192.168.100.4/32
PresharedKey = xx

**HA WireGuard config**

[Interface]

private_key: xxx
address: 192.168.100.4
dns:
  - 8.8.8.8
  - 8.8.4.4
post_up: >-
  iptables -t nat -A POSTROUTING -o wg0 -j MASQUERADE; iptables -A FORWARD -p
  tcp --tcp-flags SYN,RST SYN -j TCPMSS --clamp-mss-to-pmtu
post_down: >-
  iptables -t nat -D POSTROUTING -o wg0 -j MASQUERADE; iptables -D FORWARD -p
  tcp --tcp-flags SYN,RST SYN -j TCPMSS --clamp-mss-to-pmtu
mtu: 1420

[Peer]

- public_key: xxxx
  pre_shared_key: xxxx
  endpoint: x.x.x.x:41194
  allowed_ips:
    - 192.168.100.0/24
  persistent_keep_alive: "15"

**NAT**

Chain PREROUTING (policy ACCEPT)
num  target     prot opt source               destination
1    DNAT       6    --  0.0.0.0/0            0.0.0.0/0            tcp dpt:8123 to:192.168.100.4

Chain INPUT (policy ACCEPT)
num  target     prot opt source               destination

Chain OUTPUT (policy ACCEPT)
num  target     prot opt source               destination

Chain POSTROUTING (policy ACCEPT)
num  target     prot opt source               destination
1    MASQUERADE  0    --  0.0.0.0/0            0.0.0.0/0

**Traffic received on WireGuard Server on port 8123 generated with my smartphone outside the local network and point the public ip on port 8123**

ubuntu@oraclevps02:~$ sudo tcpdump -i wg0 port 8123
tcpdump: verbose output suppressed, use -v[v]... for full protocol decode
listening on wg0, link-type RAW (Raw IP), snapshot length 262144 bytes
19:31:07.874432 IP 162.120.156.187.32938 > 192.168.100.4.8123: Flags [S], seq 1917257810, win 65535, options [mss 1240,sackOK,TS val 3344202990 ecr 0,nop,wscale 9], length 0
19:31:08.035089 IP 162.120.156.187.32940 > 192.168.100.4.8123: Flags [S], seq 2782545296, win 65535, options [mss 1240,sackOK,TS val 3344203083 ecr 0,nop,wscale 9], length 0
19:31:08.114894 IP 162.120.156.187.32944 > 192.168.100.4.8123: Flags [S], seq 683805919, win 65535, options [mss 1240,sackOK,TS val 3344203245 ecr 0,nop,wscale 9], length 0
19:31:08.934308 IP 162.120.156.187.32938 > 192.168.100.4.8123: Flags [S], seq 1917257810, win 65535, options [mss 1240,sackOK,TS val 3344203998 ecr 0,nop,wscale 9], length 0
19:31:08.974245 IP 162.120.156.187.32940 > 192.168.100.4.8123: Flags [S], seq 2782545296, win 65535, options [mss 1240,sackOK,TS val 3344204094 ecr 0,nop,wscale 9], length 0
19:31:09.123358 IP 162.120.156.187.32944 > 192.168.100.4.8123: Flags [S], seq 683805919, win 65535, options [mss 1240,sackOK,TS val 3344204254 ecr 0,nop,wscale 9], length 0
19:31:10.974266 IP 162.120.156.187.32938 > 192.168.100.4.8123: Flags [S], seq 1917257810, win 65535, options [mss 1240,sackOK,TS val 3344206014 ecr 0,nop,wscale 9], length 0
19:31:10.983881 IP 162.120.156.187.32940 > 192.168.100.4.8123: Flags [S], seq 2782545296, win 65535, options [mss 1240,sackOK,TS val 3344206110 ecr 0,nop,wscale 9], length 0
19:31:11.154240 IP 162.120.156.187.32944 > 192.168.100.4.8123: Flags [S], seq 683805919, win 65535, options [mss 1240,sackOK,TS val 3344206270 ecr 0,nop,wscale 9], length 0

Any help is more than welcome.

Thank you in advance.

**Comment by generic1977** [comment]
> Hey, ultimately I did manage to get it working but not with the addon. There is just to much flexibility missing. I dumped HAOS since there is literally no benefit of using it over the dockerized version. And with the wireguard docker image it just worked out of the box. I actually would use something else, I recently switched to this approach: https://github.com/fosrl/pangolin which is using wireguard under the hood but takes care of every vpn and reverse proxy management. Pretty cool, I used the wireguard docker image for a year or so and recently switched to pangolin. Easy setup. Oh and yeah once again, dump HAOS, the addons are such a mess to deal with.

Thanks a lot, tobiraak! I was really close to giving up but you really helped!

I got rid of HAOS, as you suggested, and migrated HA to the docker version and made everything work. Pangolin sounds interesting but I am more familiarized with NPM and do not have much time now, but I will definitely take a look at it.

Again, thank you so much for your help.
